Sales_Order,Opportunity_ID,Opportunity_Name,Stage,Amount,Close_Date,Probability,Sales_Person,Sales_Person_Email,Company_Name,Company_Industry,Contact_Name,Contact_Title,Contact_Email,Contact_Phone,Created_Date,Last_Modified_Date,Next_Step,Description,Type,Lead_Source,State,Zip_Code,Payment_Terms
6253,OPP-2024-0077,Northwest Winery Management Platform,Value Proposition,155000,11/5/2024,45,Sarah Johnson,sjohnson@company.com,Northwest Wine Collective,Food & Beverage,Robert Wilson,Operations Manager,rwilson@northwestwine.com,555-789-3456,5/25/2024,5/30/2024,Site Assessment,Production and inventory management for wine producers,New Business,Industry Event,WI,85585,1% 15 Net 30
6254,OPP-2024-0083,Midtown School District LMS,Proposal/Price Quote,325000,9/25/2024,60,Michael Chang,mchang@company.com,Midtown School District,Education,Thomas Wilson,Technology Director,twilson@midtownschools.org,555-345-9012,5/30/2024,6/10/2024,Budget Committee,Learning management system for K-12 education,New Business,Education Conference,CO,96587,Net 60
6255,OPP-2024-0030,Valley Agricultural Cooperative System,Needs Analysis,185000,8/25/2024,35,David Martinez,dmartinez@company.com,Valley Agricultural Cooperative,Agriculture,Thomas Garcia,Executive Director,tgarcia@valleyagcoop.org,555-012-6789,5/5/2024,5/14/2024,Site Visits,Integrated management system for agricultural cooperative,New Business,Trade Show,WA,35519,Net 60
6256,OPP-2024-0070,Evergreen Manufacturing ERP System,Needs Analysis,385000,10/10/2024,35,David Martinez,dmartinez@company.com,Evergreen Manufacturing Inc.,Manufacturing,Michael Brown,Operations Director,mbrown@evergreenmfg.com,555-012-6789,5/22/2024,5/28/2024,Requirements Gathering,Enterprise resource planning system for manufacturing operations,New Business,Partner ReferralOPP-2024-0031,WA,89857,Net 45
6257,OPP-2024-0004,GreenLeaf Retail POS System,Qualification,75000,7/10/2024,20,Emma Wilson,ewilson@company.com,GreenLeaf Retail,Retail,Robert Green,Operations Manager,rgreen@greenleaf.com,555-456-7890,5/10/2024,5/12/2024,Initial Meeting,New point-of-sale system deployment across 12 retail locations,New Business,Website,IL,45713,Net 30
6258,OPP-2024-0073,State Government Records Management,Proposal/Price Quote,365000,9/15/2024,65,Michael Chang,mchang@company.com,State Government Office,Government,Thomas Garcia,Records Administrator,tgarcia@stategov.gov,555-345-9012,5/15/2024,5/30/2024,Budget Approval,Electronic records management with compliance features,New Business,RFP,OH,85512,Net 60
6259,OPP-2024-0027,Dynamic Marketing Agency CRM Implementation,Value Proposition,115000,8/18/2024,40,Sarah Johnson,sjohnson@company.com,Dynamic Marketing Group,Marketing,Julia Martinez,Account Director,jmartinez@dynamicmarketing.com,555-789-3456,5/8/2024,5/15/2024,Needs Analysis,Custom CRM implementation with marketing automation integration,New Business,Webinar,SC,40176,Net 60
6260,OPP-2024-0087,Alpine Resorts Booking System,Value Proposition,165000,11/15/2024,40,Sarah Johnson,sjohnson@company.com,Alpine Resorts Group,Hospitality,Michael Torres,Reservations Manager,mtorres@alpineresorts.com,555-789-3456,6/10/2024,6/15/2024,Demo Session,Reservation and property management system for ski resorts,New Business,Trade Show,WV,56465,Net 45
6261,OPP-2024-0066,City Water Utility Management,Perception Analysis,315000,12/5/2024,20,Alex Rodriguez,arodriguez@company.com,City Water Department,Utilities,Richard Davis,Utilities Director,rdavis@citywater.gov,555-678-2345,5/25/2024,5/28/2024,Discovery Phase,Water utility management and monitoring system,New Business,RFP,LA,82397,2% 10 Net 30
6262,OPP-2024-0004,GreenLeaf Retail POS System,Qualification,75000,7/10/2024,20,Emma Wilson,ewilson@company.com,GreenLeaf Retail,Retail,Robert Green,Operations Manager,rgreen@greenleaf.com,555-456-7890,5/10/2024,5/12/2024,Initial Meeting,New point-of-sale system deployment across 12 retail locations,New Business,Website,IL,45713,Net 30
6263,OPP-2024-0005,Oceanview Healthcare Cloud Migration,Negotiation/Review,320000,6/5/2024,80,David Martinez,dmartinez@company.com,Oceanview Healthcare,Healthcare,Samantha Patel,CTO,spatel@oceanviewhealth.com,555-567-8901,3/15/2024,5/11/2024,Contract Review,Migration of patient records and systems to secure cloud platform,New Business,Partner Referral,WY,94220,Net 45
6264,OPP-2024-0063,Central State University IT Infrastructure,Proposal/Price Quote,425000,9/5/2024,60,Michael Chang,mchang@company.com,Central State University,Education,Jennifer Lee,IT Director,jlee@centralstate.edu,555-345-9012,5/10/2024,5/24/2024,Budget Committee,IT infrastructure upgrade for main campus,New Business,Education Conference,KS,49306,Net 60
6265,OPP-2024-0073,State Government Records Management,Proposal/Price Quote,365000,9/15/2024,65,Michael Chang,mchang@company.com,State Government Office,Government,Thomas Garcia,Records Administrator,tgarcia@stategov.gov,555-345-9012,5/15/2024,5/30/2024,Budget Approval,Electronic records management with compliance features,New Business,RFP,OH,85512,Net 60
6266,OPP-2024-0011,NextGen Biotech Lab Systems,Decision Makers,275000,6/30/2024,70,Alex Rodriguez,arodriguez@company.com,NextGen Biotech,Biotechnology,Sarah Williams,Lab Director,swilliams@nextgenbio.com,555-123-7890,3/25/2024,5/14/2024,Executive Approval,Advanced laboratory information management systems,New Business,Trade Show,ND,93310,1% 15 Net 30
6267,OPP-2024-0046,Coastal Shipping Terminal Management,Perception Analysis,275000,11/10/2024,20,Alex Rodriguez,arodriguez@company.com,Coastal Shipping Inc.,Transportation,Maria Gonzalez,Terminal Manager,mgonzalez@coastalshipping.com,555-678-2345,5/20/2024,5/22/2024,Site Assessment,Terminal management system for shipping operations,New Business,LinkedIn,FL,60362,Net 45
6268,OPP-2024-0005,Oceanview Healthcare Cloud Migration,Negotiation/Review,320000,6/5/2024,80,David Martinez,dmartinez@company.com,Oceanview Healthcare,Healthcare,Samantha Patel,CTO,spatel@oceanviewhealth.com,555-567-8901,3/15/2024,5/11/2024,Contract Review,Migration of patient records and systems to secure cloud platform,New Business,Partner Referral,WY,94220,Net 45
6269,OPP-2024-0050,Horizon Energy Monitoring Solution,Needs Analysis,255000,9/20/2024,35,David Martinez,dmartinez@company.com,Horizon Energy Corporation,Energy,Michelle Wong,Operations Manager,mwong@horizonenergy.com,555-012-6789,5/15/2024,5/20/2024,Requirements Analysis,Energy usage monitoring and optimization system,New Business,Industry Event,PA,33815,Net 45
6270,OPP-2024-0012,Summit Financial Advisory Services Renewal,Negotiation/Review,110000,5/30/2024,90,Sarah Johnson,sjohnson@company.com,Summit Financial Advisors,Financial Services,Andrew Morgan,Managing Partner,amorgan@summitfinancial.com,555-234-8901,4/25/2024,5/13/2024,Contract Finalization,Annual services renewal with expanded cybersecurity package,Renewal,Existing Customer,SC,49362,2% 10 Net 30
6271,OPP-2024-0046,Coastal Shipping Terminal Management,Perception Analysis,275000,11/10/2024,20,Alex Rodriguez,arodriguez@company.com,Coastal Shipping Inc.,Transportation,Maria Gonzalez,Terminal Manager,mgonzalez@coastalshipping.com,555-678-2345,5/20/2024,5/22/2024,Site Assessment,Terminal management system for shipping operations,New Business,LinkedIn,FL,60362,Net 45
6272,OPP-2024-0090,Grand Hotel Group Property Management,Needs Analysis,295000,11/20/2024,30,David Martinez,dmartinez@company.com,Grand Hotel Group,Hospitality,Sarah Brown,Operations Director,sbrown@grandhotelgroup.com,555-012-6789,6/15/2024,6/18/2024,Site Assessment,Property management system for luxury hotel chain,New Business,Industry EventOPP-2024-0071,VA,96717,1% 15 Net 30
6273,OPP-2024-0097,Northern Community College IT Services,Value Proposition,195000,11/25/2024,45,Sarah Johnson,sjohnson@company.com,Northern Community College,Education,Michael Wilson,IT Director,mwilson@northerncc.edu,555-789-3456,6/20/2024,6/25/2024,Campus Evaluation,Managed IT services for multi-campus college,New Business,Education Conference,VT,73236,Net 60
6274,OPP-2024-0040,Blue Sky Airlines Maintenance System,Needs Analysis,355000,9/10/2024,30,David Martinez,dmartinez@company.com,Blue Sky Airlines,Aviation,Laura Martinez,Maintenance Director,lmartinez@blueskyair.com,555-012-6789,5/10/2024,5/15/2024,Requirements Workshop,Aircraft maintenance tracking and scheduling system,New Business,Industry Event,IA,97839,Net 60
6275,OPP-2024-0076,Eastern Insurance Policy System,Perception Analysis,295000,12/15/2024,20,Alex Rodriguez,arodriguez@company.com,Eastern Insurance Group,Insurance,Michelle Thompson,Operations Director,mthompson@easterninsurance.com,555-678-2345,5/28/2024,5/30/2024,Discovery Workshop,Policy management system with customer portal,New Business,Cold Call,MD,36812,Net 45
6276,OPP-2024-0083,Midtown School District LMS,Proposal/Price Quote,325000,9/25/2024,60,Michael Chang,mchang@company.com,Midtown School District,Education,Thomas Wilson,Technology Director,twilson@midtownschools.org,555-345-9012,5/30/2024,6/10/2024,Budget Committee,Learning management system for K-12 education,New Business,Education Conference,CO,96587,Net 60
6277,OPP-2024-0012,Summit Financial Advisory Services Renewal,Negotiation/Review,110000,5/30/2024,90,Sarah Johnson,sjohnson@company.com,Summit Financial Advisors,Financial Services,Andrew Morgan,Managing Partner,amorgan@summitfinancial.com,555-234-8901,4/25/2024,5/13/2024,Contract Finalization,Annual services renewal with expanded cybersecurity package,Renewal,Existing Customer,SC,49362,2% 10 Net 30
6278,OPP-2024-0075,Advanced Materials Quality Control,Negotiation/Review,235000,8/25/2024,80,David Martinez,dmartinez@company.com,Advanced Materials Inc.,Manufacturing,Jason Park,Quality Director,jpark@advancedmaterials.com,555-567-1234,6/5/2024,5/28/2024,Contract Review,Quality control system for specialized manufacturing,New Business,Trade Show,FL,28336,Net 45
6279,OPP-2024-0100,Eastern Manufacturing ERP System,Needs Analysis,375000,11/30/2024,30,David Martinez,dmartinez@company.com,Eastern Manufacturing Inc.,Manufacturing,Sarah Lee,Operations Director,slee@easternmfg.com,555-012-6789,6/25/2024,6/30/2024,Requirements Gathering,Enterprise resource planning system with supply chain integration,New Business,Industry EventOPP-2024-0081,SC,79305,2% 10 Net 30
6280,OPP-2024-0056,Metropolitan Police Records Management,Perception Analysis,320000,11/25/2024,15,Alex Rodriguez,arodriguez@company.com,Metropolitan Police Department,Government,Michael Wilson,Records Administrator,mwilson@metropolice.gov,555-678-2345,5/25/2024,5/28/2024,Initial Assessment,Records management system with compliance features,New Business,RFP,NM,51394,Net 60
6281,OPP-2024-0088,Eastside Transit Authority Ticketing,Qualification,245000,11/5/2024,30,Michael Chang,mchang@company.com,Eastside Transit Authority,Transportation,Jennifer Lee,Fare Systems Manager,jlee@eastsidetransit.org,555-890-4567,6/10/2024,6/15/2024,Requirements Analysis,Mobile ticketing system with contactless payment,New Business,Partner Referral,MI,21542,Net 45
6282,OPP-2024-0047,University Research Database,Value Proposition,165000,10/5/2024,40,Sarah Johnson,sjohnson@company.com,University Research Foundation,Education,William Chen,Research Director,wchen@universityresearch.edu,555-789-3456,5/15/2024,5/18/2024,Capability Demo,Research database with collaboration tools for multi-institution projects,New Business,Conference,NY,52791,Net 60
6283,OPP-2024-0050,Horizon Energy Monitoring Solution,Needs Analysis,255000,9/20/2024,35,David Martinez,dmartinez@company.com,Horizon Energy Corporation,Energy,Michelle Wong,Operations Manager,mwong@horizonenergy.com,555-012-6789,5/15/2024,5/20/2024,Requirements Analysis,Energy usage monitoring and optimization system,New Business,Industry Event,PA,33815,Net 45
6284,OPP-2024-0083,Midtown School District LMS,Proposal/Price Quote,325000,9/25/2024,60,Michael Chang,mchang@company.com,Midtown School District,Education,Thomas Wilson,Technology Director,twilson@midtownschools.org,555-345-9012,5/30/2024,6/10/2024,Budget Committee,Learning management system for K-12 education,New Business,Education Conference,CO,96587,Net 60
6285,OPP-2024-0001,Enterprise Security Solution Implementation,Needs Analysis,125000,5/20/2024,30,Alex Rodriguez,arodriguez@company.com,Pinnacle Technologies,Technology,Martin Chen,IT Director,mchen@pinnacle-tech.com,555-123-4567,5/5/2024,5/10/2024,Technical Demo,Enterprise-wide security implementation for all 8 office locations,New Business,Trade Show,NJ,84641,1% 15 Net 30
6286,OPP-2024-0068,Regional Transit Ticketing System,Qualification,225000,10/15/2024,30,Michael Chang,mchang@company.com,Regional Transit Authority,Transportation,Andrew Wilson,Fare Systems Manager,awilson@regionaltransit.org,555-890-4567,5/25/2024,5/30/2024,Needs Analysis,Mobile ticketing system with contactless payment,New Business,Industry Event,ND,53075,Net 45
6287,OPP-2024-0023,Harbor Logistics Fleet Management,Proposal/Price Quote,235000,7/30/2024,60,Michael Chang,mchang@company.com,Harbor Logistics,Transportation,Rebecca Torres,Operations Manager,rtorres@harborlogistics.com,555-345-9012,4/25/2024,5/14/2024,ROI Analysis,Fleet management and route optimization solution for 120 vehicles,New Business,Webinar,FL,58016,Net 45
6288,OPP-2024-0097,Northern Community College IT Services,Value Proposition,195000,11/25/2024,45,Sarah Johnson,sjohnson@company.com,Northern Community College,Education,Michael Wilson,IT Director,mwilson@northerncc.edu,555-789-3456,6/20/2024,6/25/2024,Campus Evaluation,Managed IT services for multi-campus college,New Business,Education Conference,VT,73236,Net 60
6289,OPP-2024-0032,Northeast Medical Group EHR Integration,Decision Makers,285000,7/5/2024,70,Sarah Johnson,sjohnson@company.com,Northeast Medical Group,Healthcare,Michael Brown,Medical Director,mbrown@northeastmedical.org,555-234-8901,4/10/2024,5/15/2024,Stakeholder Meeting,Electronic health record integration across 15 clinics,New Business,Industry Event,KY,26127,Net 60
6290,OPP-2024-0043,Silver State Government Records System,Proposal/Price Quote,385000,8/30/2024,60,Michael Chang,mchang@company.com,Silver State Government,Government,Andrew Wilson,Records Manager,awilson@silverstate.gov,555-345-9012,4/15/2024,5/18/2024,Budget Approval,Electronic records management system with compliance features,New Business,RFP,ME,90519,Net 60
6291,OPP-2024-0045,Summit Manufacturing Automation,Negotiation/Review,325000,7/20/2024,85,David Martinez,dmartinez@company.com,Summit Manufacturing Inc.,Manufacturing,Richard Lee,Production Director,rlee@summitmanufacturing.com,555-567-1234,4/25/2024,5/15/2024,Contract Details,Factory automation system for production line,New Business,Trade Show,VT,81631,Net 45
6292,OPP-2024-0082,Northern Regional Hospital Patient Portal,Decision Makers,185000,9/5/2024,75,Sarah Johnson,sjohnson@company.com,Northern Regional Hospital,Healthcare,Elizabeth Chen,Patient Services Director,echen@northernhospital.org,555-234-8901,6/5/2024,6/8/2024,Executive Approval,Patient portal with appointment scheduling and records access,New Business,Healthcare Conference,MN,29039,Net 60
6293,OPP-2024-0022,Elite Sports Performance Analytics,Decision Makers,145000,6/25/2024,70,Sarah Johnson,sjohnson@company.com,Elite Sports Academy,Sports,Marcus Johnson,Performance Director,mjohnson@elitesports.org,555-234-8901,4/10/2024,5/15/2024,Executive Demo,Athletic performance analytics platform for training optimization,New Business,Trade Show,KS,41363,1% 15 Net 30
6294,OPP-2024-0075,Advanced Materials Quality Control,Negotiation/Review,235000,8/25/2024,80,David Martinez,dmartinez@company.com,Advanced Materials Inc.,Manufacturing,Jason Park,Quality Director,jpark@advancedmaterials.com,555-567-1234,6/5/2024,5/28/2024,Contract Review,Quality control system for specialized manufacturing,New Business,Trade Show,FL,28336,Net 45
6295,OPP-2024-0030,Valley Agricultural Cooperative System,Needs Analysis,185000,8/25/2024,35,David Martinez,dmartinez@company.com,Valley Agricultural Cooperative,Agriculture,Thomas Garcia,Executive Director,tgarcia@valleyagcoop.org,555-012-6789,5/5/2024,5/14/2024,Site Visits,Integrated management system for agricultural cooperative,New Business,Trade Show,WA,35519,Net 60
6296,OPP-2024-0055,Northwest Credit Union Digital Banking,Negotiation/Review,265000,8/5/2024,85,David Martinez,dmartinez@company.com,Northwest Credit Union,Financial Services,Daniel Park,CTO,dpark@northwestcu.org,555-567-1234,5/10/2024,5/20/2024,Contract Finalization,Digital banking platform with mobile application,New Business,Webinar,MS,67376,2% 10 Net 30
6297,OPP-2024-0096,Coastal Water District Management,Perception Analysis,345000,1/10/2025,20,Alex Rodriguez,arodriguez@company.com,Coastal Water District,Utilities,Sarah Brown,Operations Director,sbrown@coastalwater.gov,555-678-2345,6/20/2024,6/25/2024,Initial Assessment,Water utility management and monitoring system,New Business,RFP,OR,74721,Net 45
6298,OPP-2024-0042,Riverdale Healthcare Analytics Platform,Decision Makers,215000,7/15/2024,75,Sarah Johnson,sjohnson@company.com,Riverdale Healthcare,Healthcare,Elizabeth Moore,Analytics Director,emoore@riverdalehealthcare.org,555-234-8901,4/20/2024,5/15/2024,Final Presentation,Healthcare analytics platform for patient outcomes optimization,New Business,Conference,ND,86343,Net 45
6299,OPP-2024-0028,Seaside Restaurant Chain POS Upgrade,Qualification,95000,9/5/2024,20,Michael Chang,mchang@company.com,Seaside Restaurants Inc.,Food & Beverage,David Chen,Operations Director,dchen@seasiderestaurants.com,555-890-4567,5/12/2024,5/15/2024,Initial Meeting,Point-of-sale system upgrade for 12 restaurant locations,Upgrade,Cold Call,CT,26119,2% 10 Net 30
6300,OPP-2024-0035,Pacific Shipping Logistics Platform,Negotiation/Review,265000,7/10/2024,80,David Martinez,dmartinez@company.com,Pacific Shipping Company,Transportation,Karen Lee,Logistics Director,klee@pacificshipping.com,555-567-1234,4/15/2024,5/15/2024,Contract Review,Logistics management platform with real-time tracking,New Business,Partner Referral,KY,83485,Net 45
6301,OPP-2024-0077,Northwest Winery Management Platform,Value Proposition,155000,11/5/2024,45,Sarah Johnson,sjohnson@company.com,Northwest Wine Collective,Food & Beverage,Robert Wilson,Operations Manager,rwilson@northwestwine.com,555-789-3456,5/25/2024,5/30/2024,Site Assessment,Production and inventory management for wine producers,New Business,Industry Event,WI,85585,1% 15 Net 30
6302,OPP-2024-0016,Riverway Insurance Claims Processing,Perception Analysis,215000,8/20/2024,20,Alex Rodriguez,arodriguez@company.com,Riverway Insurance Group,Insurance,Robert Taylor,Claims Director,rtaylor@riverwayinsurance.com,555-678-2345,5/10/2024,5/15/2024,Requirements Workshop,Automated claims processing system with AI capabilities,New Business,Cold Call,MA,87497,1% 15 Net 30
6303,OPP-2024-0008,Thompson Construction IT Infrastructure,Value Proposition,185000,7/25/2024,40,Michael Chang,mchang@company.com,Thompson Construction,Construction,Daniel Thompson,CEO,dthompson@thompsonconstruction.com,555-890-1234,5/2/2024,5/14/2024,Site Assessment,Complete IT infrastructure for new headquarters building,New Business,LinkedIn,IL,22775,Net 30
6304,OPP-2024-0046,Coastal Shipping Terminal Management,Perception Analysis,275000,11/10/2024,20,Alex Rodriguez,arodriguez@company.com,Coastal Shipping Inc.,Transportation,Maria Gonzalez,Terminal Manager,mgonzalez@coastalshipping.com,555-678-2345,5/20/2024,5/22/2024,Site Assessment,Terminal management system for shipping operations,New Business,LinkedIn,FL,60362,Net 45
6305,OPP-2024-0077,Northwest Winery Management Platform,Value Proposition,155000,11/5/2024,45,Sarah Johnson,sjohnson@company.com,Northwest Wine Collective,Food & Beverage,Robert Wilson,Operations Manager,rwilson@northwestwine.com,555-789-3456,5/25/2024,5/30/2024,Site Assessment,Production and inventory management for wine producers,New Business,Industry Event,WI,85585,1% 15 Net 30
6306,OPP-2024-0046,Coastal Shipping Terminal Management,Perception Analysis,275000,11/10/2024,20,Alex Rodriguez,arodriguez@company.com,Coastal Shipping Inc.,Transportation,Maria Gonzalez,Terminal Manager,mgonzalez@coastalshipping.com,555-678-2345,5/20/2024,5/22/2024,Site Assessment,Terminal management system for shipping operations,New Business,LinkedIn,FL,60362,Net 45
6307,OPP-2024-0025,Golden State Credit Union Digital Banking,Negotiation/Review,310000,6/15/2024,85,David Martinez,dmartinez@company.com,Golden State Credit Union,Financial Services,Nancy Lee,Digital Banking Director,nlee@goldenstatecu.org,555-567-1234,3/20/2024,5/15/2024,Legal Review,Digital banking platform upgrade with enhanced security features,Upgrade,Existing Customer,CO,25015,2% 10 Net 30
6308,OPP-2024-0055,Northwest Credit Union Digital Banking,Negotiation/Review,265000,8/5/2024,85,David Martinez,dmartinez@company.com,Northwest Credit Union,Financial Services,Daniel Park,CTO,dpark@northwestcu.org,555-567-1234,5/10/2024,5/20/2024,Contract Finalization,Digital banking platform with mobile application,New Business,Webinar,MS,67376,2% 10 Net 30
6309,OPP-2024-0088,Eastside Transit Authority Ticketing,Qualification,245000,11/5/2024,30,Michael Chang,mchang@company.com,Eastside Transit Authority,Transportation,Jennifer Lee,Fare Systems Manager,jlee@eastsidetransit.org,555-890-4567,6/10/2024,6/15/2024,Requirements Analysis,Mobile ticketing system with contactless payment,New Business,Partner Referral,MI,21542,Net 45
6310,OPP-2024-0012,Summit Financial Advisory Services Renewal,Negotiation/Review,110000,5/30/2024,90,Sarah Johnson,sjohnson@company.com,Summit Financial Advisors,Financial Services,Andrew Morgan,Managing Partner,amorgan@summitfinancial.com,555-234-8901,4/25/2024,5/13/2024,Contract Finalization,Annual services renewal with expanded cybersecurity package,Renewal,Existing Customer,SC,49362,2% 10 Net 30
6311,OPP-2024-0078,Metro Healthcare Network Refresh,Qualification,385000,10/25/2024,25,Michael Chang,mchang@company.com,Metro Healthcare System,Healthcare,Jennifer Davis,IT Director,jdavis@metrohealthcare.org,555-890-4567,5/30/2024,6/2/2024,Technical Evaluation,Network infrastructure refresh for 8 medical facilities,Upgrade,Healthcare Conference,SD,38280,Net 60
6312,OPP-2024-0016,Riverway Insurance Claims Processing,Perception Analysis,215000,8/20/2024,20,Alex Rodriguez,arodriguez@company.com,Riverway Insurance Group,Insurance,Robert Taylor,Claims Director,rtaylor@riverwayinsurance.com,555-678-2345,5/10/2024,5/15/2024,Requirements Workshop,Automated claims processing system with AI capabilities,New Business,Cold Call,MA,87497,1% 15 Net 30
6313,OPP-2024-0046,Coastal Shipping Terminal Management,Perception Analysis,275000,11/10/2024,20,Alex Rodriguez,arodriguez@company.com,Coastal Shipping Inc.,Transportation,Maria Gonzalez,Terminal Manager,mgonzalez@coastalshipping.com,555-678-2345,5/20/2024,5/22/2024,Site Assessment,Terminal management system for shipping operations,New Business,LinkedIn,FL,60362,Net 45
6314,OPP-2024-0092,Mountain State Government Portal,Decision Makers,315000,9/20/2024,70,Sarah Johnson,sjohnson@company.com,Mountain State Government,Government,Elizabeth Wilson,IT Director,ewilson@mountainstate.gov,555-234-8901,6/15/2024,6/20/2024,Executive Briefing,Citizen portal with online services and payments,New Business,RFP,MT,68222,Net 60
6315,OPP-2024-0095,Precision Manufacturing Quality System,Negotiation/Review,325000,9/25/2024,85,David Martinez,dmartinez@company.com,Precision Manufacturing Inc.,Manufacturing,Robert Park,Quality Manager,rpark@precisionmfg.com,555-567-1234,6/25/2024,6/28/2024,Contract Finalization,Quality management system for precision manufacturing,New Business,Partner Referral,NV,73270,Net 45
6316,OPP-2024-0017,Metropolitan University IT Support Contract,Qualification,320000,9/15/2024,35,Sarah Johnson,sjohnson@company.com,Metropolitan University,Education,Jennifer Adams,IT Director,jadams@metrouniversity.edu,555-789-3456,5/7/2024,5/14/2024,Campus Visit,3-year IT support contract for main and satellite campuses,New Business,Referral,NE,64696,Net 60
6317,OPP-2024-0018,Sunshine Resorts Property Management System,Value Proposition,175000,7/5/2024,45,Michael Chang,mchang@company.com,Sunshine Resorts & Spa,Hospitality,Kevin Wong,Property Manager,kwong@sunshineresorts.com,555-890-4567,4/30/2024,5/13/2024,Demo Preparation,Integrated property management system for 8 resort locations,New Business,Partner Referral,RI,90638,Net 45
6318,OPP-2024-0066,City Water Utility Management,Perception Analysis,315000,12/5/2024,20,Alex Rodriguez,arodriguez@company.com,City Water Department,Utilities,Richard Davis,Utilities Director,rdavis@citywater.gov,555-678-2345,5/25/2024,5/28/2024,Discovery Phase,Water utility management and monitoring system,New Business,RFP,LA,82397,2% 10 Net 30
6319,OPP-2024-0010,Parkway Hotels Guest Experience Platform,Perception Analysis,155000,6/22/2024,15,David Martinez,dmartinez@company.com,Parkway Hotels & Resorts,Hospitality,Michael Johnson,Guest Relations Director,mjohnson@parkwayhotels.com,555-012-3456,5/12/2024,5/15/2024,Discovery Meeting,Mobile platform for enhanced guest experience across 25 properties,New Business,Web Demo,WI,77211,2% 10 Net 30
6320,OPP-2024-0037,Midwest School District Technology Refresh,Value Proposition,420000,11/15/2024,45,Sarah Johnson,sjohnson@company.com,Midwest School District,Education,Patricia Wilson,Technology Director,pwilson@midwestschools.org,555-789-3456,5/15/2024,5/18/2024,Budget Analysis,Technology refresh for 12 schools including hardware and software,New Business,Email Campaign,MD,98700,Net 60
6321,OPP-2024-0045,Summit Manufacturing Automation,Negotiation/Review,325000,7/20/2024,85,David Martinez,dmartinez@company.com,Summit Manufacturing Inc.,Manufacturing,Richard Lee,Production Director,rlee@summitmanufacturing.com,555-567-1234,4/25/2024,5/15/2024,Contract Details,Factory automation system for production line,New Business,Trade Show,VT,81631,Net 45
